{
  "$schema": "https://ivankotov.eu/schemas/scientific-corpus-index-v1.schema.json",
  "schema_version": "scientific-corpus-index.v1",
  "document_id": "ivankotov-public-authored-corpus-index-v1",
  "url": "https://ivankotov.eu/scientific-corpus-index.json",
  "last_verified": "2026-09-04",
  "author": {
    "name": "Ivan Kotov",
    "orcid": "https://orcid.org/0009-0009-6002-9845",
    "profile": "https://ivankotov.eu/about/"
  },
  "scope": "Normalized discovery layer for public research, software, protocol, book, and authorial-statement records listed in works-index.json.",
  "authority_rule": "This index is a routing projection. DOI records, signed releases, tagged repository states, and explicitly named canonical source files retain their stated authority.",
  "claim_boundary": "Listing, normalization, or JSON-LD typing does not elevate scientific, technical, legal, empirical, continuity, entity, consciousness, personhood, safety, certification, or deployment claims.",
  "source": {
    "url": "https://ivankotov.eu/works-index.json",
    "sha256": "caff63feabd64324a190314fd2b6568f4b115db66fc15e44a7525fa5380e0053",
    "record_count": 57
  },
  "work_count": 57,
  "works": [
    {
      "id": "boundary-preserving-ai-composition-v0-4",
      "@id": "https://ivankotov.eu/id/work/boundary-preserving-ai-composition-v0-4",
      "schema_org_type": "ScholarlyArticle",
      "source_type": "paper",
      "title": "Boundary-Preserving Composition of Personal and Enterprise AI Systems",
      "alternative_title": null,
      "role": "boundary-preserving personal/enterprise AI composition and matched evaluation agenda",
      "summary": "Source-grounded technical report on preserving authority, custody, provenance and resource boundaries across personal/enterprise AI lifecycle transitions. 24 inert scenario definitions; no empirical result.",
      "primary_url": "https://ivankotov.eu/publications/boundary-preserving-ai-composition-v0-4/",
      "version": "0.4",
      "date": "2026-09-15",
      "status": "published_technical_report",
      "languages": [
        "en"
      ],
      "source_language_labels": [],
      "identifiers": {
        "published_doi": "https://doi.org/10.5281/zenodo.22766595",
        "doi_role": "version",
        "version_doi": "https://doi.org/10.5281/zenodo.22766595",
        "concept_doi": null,
        "other": []
      },
      "source": {
        "repository_url": "https://github.com/Kot141078/advanced-global-intelligence",
        "repository_detail_url": "https://github.com/Kot141078/advanced-global-intelligence/tree/0fc792d191d51703dc151350609150839bb4ed4f/publications/boundary-preserving-ai-composition-v0-4",
        "repository_path": null,
        "release_url": null,
        "release_tag": null,
        "commit": "0fc792d191d51703dc151350609150839bb4ed4f"
      },
      "licenses": {
        "overall": "CC BY 4.0",
        "software": "CC-BY-4.0",
        "documentation": null,
        "machine_metadata": null,
        "rights": null
      },
      "integrity": {
        "sha256": null,
        "archive_sha256": "30fdd6a3d283f6602f96cdce56f805279a3cb9e9e32b7b5036c04d3fa21fa05a",
        "manifest_url": null,
        "checksums_url": null
      },
      "claim_boundary": {
        "non_claims": [
          "no integrated implementation",
          "no empirical comparison result",
          "no economic advantage result",
          "no identity-continuity or consciousness result",
          "no c-specific formation effect",
          "not independently peer reviewed"
        ],
        "source_field": "non_claims",
        "rule": "Publication, DOI, repository presence, checksum, or internal review does not by itself establish implementation, reproduction, validation, safety, entity status, consciousness, personhood, or deployment authorization."
      },
      "metadata_completeness": {
        "known": [
          "version",
          "date",
          "version_doi",
          "languages",
          "license",
          "repository",
          "claim_boundary"
        ],
        "unknown": []
      },
      "legacy_source_pointer": "/works-index.json#/works/0"
    },
    {
      "id": "shared-open-worlds-human-ai-dyads-v0-2",
      "@id": "https://ivankotov.eu/id/work/shared-open-worlds-human-ai-dyads-v0-2",
      "schema_org_type": "ScholarlyArticle",
      "source_type": "paper",
      "title": "Shared Open Worlds for Human–AI Dyads: Role Switching, Experience Qualification, and Cross-World Continuity Evaluation",
      "alternative_title": null,
      "role": "conceptual human–AI co-play and cross-world evaluation proposal",
      "summary": "A conceptual research preprint on shared human–AI gameplay, role switching, qualified experience and cross-world evaluation. No empirical result is reported.",
      "primary_url": "https://ivankotov.eu/publications/shared-open-worlds-human-ai-dyads-v0-2/",
      "version": "0.2",
      "date": "2026-09-06",
      "status": "published_preprint",
      "languages": [
        "en"
      ],
      "source_language_labels": [],
      "identifiers": {
        "published_doi": "https://doi.org/10.5281/zenodo.22542470",
        "doi_role": "version",
        "version_doi": "https://doi.org/10.5281/zenodo.22542470",
        "concept_doi": "https://doi.org/10.5281/zenodo.22542469",
        "other": []
      },
      "source": {
        "repository_url": "https://github.com/Kot141078/advanced-global-intelligence",
        "repository_detail_url": "https://github.com/Kot141078/advanced-global-intelligence/tree/259055a705689d86e6d7099dfa4f40e3d81b9a7d/publications/shared-open-worlds-human-ai-dyads-v0-2",
        "repository_path": null,
        "release_url": null,
        "release_tag": null,
        "commit": "259055a705689d86e6d7099dfa4f40e3d81b9a7d"
      },
      "licenses": {
        "overall": "CC BY 4.0",
        "software": "CC-BY-4.0",
        "documentation": null,
        "machine_metadata": null,
        "rights": null
      },
      "integrity": {
        "sha256": null,
        "archive_sha256": "47945ca619f65ea6788de84c22ee278d0cee29fba929ab0e7e1db5fe17cc92ce",
        "manifest_url": "https://ivankotov.eu/publications/shared-open-worlds-human-ai-dyads-v0-2/files/SHA256SUMS.txt",
        "checksums_url": "https://ivankotov.eu/publications/shared-open-worlds-human-ai-dyads-v0-2/files/A_C_SHARED_OPEN_WORLD_EXPERIENCE_v0_2_EN_PUBLIC.zip.sha256"
      },
      "claim_boundary": {
        "non_claims": [
          "no empirical experiment or runtime implementation",
          "not independently peer reviewed in English v0.2",
          "no independently annotated benchmark",
          "no distinct C/B1 treatment established",
          "no identity-continuity, consciousness, new-AI-class or economic-superiority result"
        ],
        "source_field": "non_claims",
        "rule": "Publication, DOI, repository presence, checksum, or internal review does not by itself establish implementation, reproduction, validation, safety, entity status, consciousness, personhood, or deployment authorization."
      },
      "metadata_completeness": {
        "known": [
          "version",
          "date",
          "version_doi",
          "languages",
          "license",
          "repository",
          "claim_boundary"
        ],
        "unknown": []
      },
      "legacy_source_pointer": "/works-index.json#/works/1"
    },
    {
      "id": "scientific-corrections-v1-0",
      "@id": "https://ivankotov.eu/id/work/scientific-corrections-v1-0",
      "schema_org_type": "CreativeWork",
      "source_type": "publication",
      "title": "Scientific Corrigenda and Regression Hardening for ARQ M2, MOT-c and C-Calculus",
      "alternative_title": null,
      "role": "source-bound scientific corrections and reproducible document regression hardening",
      "summary": "Corrections to ARQ M2 initial-state and resource-accounting formulas, EN/RU MOT-c Appendix A LATENT examples and C-Calculus relation taxonomy/finite adjacency. Four complete corrected reading editions and 29 focused first-party tests.",
      "primary_url": "https://ivankotov.eu/publications/scientific-corrections-v1-0/",
      "version": "1.0",
      "date": "2026-09-05",
      "status": "published_scientific_corrigendum_with_zenodo_doi",
      "languages": [
        "en",
        "ru"
      ],
      "source_language_labels": [],
      "identifiers": {
        "published_doi": "https://doi.org/10.5281/zenodo.22402601",
        "doi_role": "version",
        "version_doi": "https://doi.org/10.5281/zenodo.22402601",
        "concept_doi": "https://doi.org/10.5281/zenodo.22402600",
        "other": []
      },
      "source": {
        "repository_url": "https://github.com/Kot141078/advanced-global-intelligence",
        "repository_detail_url": "https://github.com/Kot141078/advanced-global-intelligence/tree/78bce9419de6006a21fdfd8fcf1aee35c383205c/hardening/scientific_corrigenda_v1_0",
        "repository_path": null,
        "release_url": null,
        "release_tag": null,
        "commit": "78bce9419de6006a21fdfd8fcf1aee35c383205c"
      },
      "licenses": {
        "overall": "CC BY 4.0; source material retains original licenses",
        "software": "MIT",
        "documentation": null,
        "machine_metadata": null,
        "rights": null
      },
      "integrity": {
        "sha256": null,
        "archive_sha256": "ca1e741f7d4f2dbf76a4a66fed7a5d83cf37e599e0fc4552bbca5aaa59b4ffde",
        "manifest_url": "https://ivankotov.eu/publications/scientific-corrections-v1-0/files/SHA256SUMS.txt",
        "checksums_url": "https://ivankotov.eu/publications/scientific-corrections-v1-0/files/SCIENTIFIC_CORRIGENDA_HARDENING_v1_0.zip.sha256"
      },
      "claim_boundary": {
        "non_claims": [
          "not a complete replacement of the parent compound releases",
          "the correction DOI does not replace or rewrite parent DOI payloads",